name,ip,description
router,10.0.0.1,router podman container on yaghl-internal
alfred2p0,10.0.0.55,yaghl-shim interface on container host
dnsmasq,10.0.0.60,dnsmasq podman container on yaghl-internal
redis,10.0.0.65,redis podman container on yaghl-internal
foremanlite,10.0.0.70,foremanlite podman container on yaghl-internal
rpi1.yaghl,10.0.0.121,Raspberry Pi One (leftmost; static DHCP)
rpi2.yaghl,10.0.0.122,Raspberry Pi Two (middle; static DHCP)
rpi3.yaghl,10.0.0.123,Raspberry Pi Three (rightmost; static DHCP)

